{
  "feature_count": 283,
  "features": [
    {},
    {},
    {},
    {},
    {},
    {},
    {},
    {},
    {},
    {},
    {},
    {},
    {},
    {},
    {},
    {},
    {},
    {},
    {},
    {},
    {},
    {},
    {},
    {},
    {},
    {},
    {},
    {},
    {},
    {},
    {},
    {},
    {},
    {},
    {},
    {},
    {},
    {},
    {},
    {},
    {},
    {},
    {},
    {},
    {},
    {},
    {},
    {},
    {},
    {},
    {},
    {},
    {},
    {},
    {},
    {},
    {},
    {},
    {},
    {},
    {},
    {},
    {},
    {},
    {},
    {},
    {},
    {},
    {},
    {},
    {},
    {},
    {},
    {},
    {},
    {},
    {},
    {},
    {},
    {},
    {},
    {},
    {},
    {},
    {},
    {},
    {},
    {},
    {},
    {},
    {},
    {},
    {},
    {},
    {},
    {},
    {},
    {},
    {},
    {},
    {},
    {},
    {},
    {},
    {},
    {},
    {},
    {},
    {},
    {},
    {},
    {},
    {},
    {},
    {},
    {},
    {},
    {},
    {},
    {},
    {},
    {},
    {},
    {},
    {},
    {},
    {},
    {},
    {},
    {},
    {},
    {},
    {},
    {},
    {},
    {},
    {},
    {},
    {},
    {},
    {},
    {},
    {},
    {},
    {},
    {},
    {},
    {},
    {},
    {},
    {},
    {},
    {},
    {},
    {},
    {},
    {},
    {},
    {},
    {},
    {},
    {},
    {},
    {},
    {},
    {},
    {},
    {},
    {},
    {},
    {},
    {},
    {},
    {},
    {},
    {},
    {},
    {},
    {},
    {},
    {},
    {},
    {},
    {},
    {},
    {},
    {},
    {},
    {},
    {},
    {},
    {},
    {},
    {},
    {},
    {},
    {},
    {},
    {},
    {},
    {},
    {},
    {},
    {},
    {},
    {},
    {},
    {},
    {},
    {},
    {},
    {},
    {},
    {},
    {},
    {},
    {},
    {},
    {},
    {},
    {},
    {},
    {},
    {},
    {},
    {},
    {},
    {},
    {},
    {},
    {},
    {},
    {},
    {},
    {},
    {},
    {},
    {},
    {},
    {},
    {},
    {},
    {},
    {},
    {},
    {},
    {},
    {},
    {},
    {},
    {},
    {},
    {},
    {},
    {},
    {},
    {},
    {},
    {},
    {},
    {},
    {},
    {},
    {},
    {},
    {},
    {},
    {},
    {},
    {},
    {},
    {},
    {},
    {},
    {},
    {},
    {},
    {},
    {},
    {},
    {},
    {},
    {}
  ],
  "frame_rate_hz": 30,
  "joint_count": 33,
  "normalization_version": "normalization.corrected-v1",
  "receptive_field_frames": 125,
  "schema_version": "feature.v1",
  "stride_frames": 8,
  "window_frames": 128
}
